{
  "schema_version": "1.3.0",
  "methodology": {
    "id": "bcm-geo-evidence-action-retest",
    "version": "1.0.0",
    "contract_version": "1.3.0",
    "claim_boundary": "Observed evidence only; no automatic causal or provider-wide claim."
  },
  "study_id": "example-study",
  "purpose": "Synthetic demonstration data only",
  "source_format": "synthetic",
  "observations": [
    {
      "observation_id": "base-001",
      "panel_version": "demo-v1",
      "prompt_id": "category-shortlist",
      "prompt_hash": "1111111111111111111111111111111111111111111111111111111111111111",
      "provider": "example-ai-a",
      "model": "example-model-1",
      "locale": "en-US",
      "region": "US",
      "observed_at": "2026-08-01T09:00:00+00:00",
      "status": "not_mentioned",
      "brand": "Example Brand",
      "source_urls": [],
      "evidence_excerpt": "The answer listed alternatives but did not mention Example Brand.",
      "capture_ref": "synthetic/base-001",
      "limitations": "Synthetic example; not a live provider observation."
    },
    {
      "observation_id": "base-002",
      "panel_version": "demo-v1",
      "prompt_id": "evidence-check",
      "prompt_hash": "2222222222222222222222222222222222222222222222222222222222222222",
      "provider": "example-ai-a",
      "model": "example-model-1",
      "locale": "en-US",
      "region": "US",
      "observed_at": "2026-08-01T09:05:00+00:00",
      "status": "mentioned",
      "brand": "Example Brand",
      "source_urls": [],
      "evidence_excerpt": "Example Brand appeared in a neutral list without a source link.",
      "capture_ref": "synthetic/base-002",
      "limitations": "Synthetic example; not a live provider observation."
    },
    {
      "observation_id": "base-003",
      "panel_version": "demo-v1",
      "prompt_id": "local-choice",
      "prompt_hash": "3333333333333333333333333333333333333333333333333333333333333333",
      "provider": "example-ai-a",
      "model": "example-model-1",
      "locale": "zh-CN",
      "region": "CN",
      "observed_at": "2026-08-01T09:10:00+00:00",
      "status": "unavailable",
      "brand": "Example Brand",
      "source_urls": [],
      "evidence_excerpt": "No valid answer was returned during the observation window.",
      "capture_ref": "synthetic/base-003",
      "limitations": "Synthetic example; provider unavailable."
    },
    {
      "observation_id": "base-004",
      "panel_version": "demo-v1",
      "prompt_id": "trust-proof",
      "prompt_hash": "4444444444444444444444444444444444444444444444444444444444444444",
      "provider": "example-ai-b",
      "model": "example-model-2",
      "locale": "en-US",
      "region": "US",
      "observed_at": "2026-08-01T09:15:00+00:00",
      "status": "cited",
      "brand": "Example Brand",
      "source_urls": ["https://example.com/evidence"],
      "evidence_excerpt": "The answer linked to an Example Brand evidence page.",
      "capture_ref": "synthetic/base-004",
      "limitations": "Synthetic example; not a live provider observation."
    },
    {
      "observation_id": "base-005",
      "panel_version": "demo-v1",
      "prompt_id": "comparison",
      "prompt_hash": "5555555555555555555555555555555555555555555555555555555555555555",
      "provider": "example-ai-b",
      "model": "example-model-2",
      "locale": "zh-CN",
      "region": "CN",
      "observed_at": "2026-08-01T09:20:00+00:00",
      "status": "not_mentioned",
      "brand": "Example Brand",
      "source_urls": [],
      "evidence_excerpt": "The comparison did not include Example Brand.",
      "capture_ref": "synthetic/base-005",
      "limitations": "Synthetic example; not a live provider observation."
    },
    {
      "observation_id": "base-006",
      "panel_version": "demo-v1",
      "prompt_id": "risk-check",
      "prompt_hash": "6666666666666666666666666666666666666666666666666666666666666666",
      "provider": "example-ai-b",
      "model": "example-model-2",
      "locale": "zh-CN",
      "region": "CN",
      "observed_at": "2026-08-01T09:25:00+00:00",
      "status": "not_mentioned",
      "brand": "Example Brand",
      "source_urls": [],
      "evidence_excerpt": "No positive or negative reference to Example Brand was present.",
      "capture_ref": "synthetic/base-006",
      "limitations": "Synthetic example; not a live provider observation."
    }
  ]
}
